Aisles,Product,amountBought
"body lotions soap","Moisture Wrap Daily Repair Body Lotion",63
"body lotions soap","Sensitive Skin Bar",62
"body lotions soap","Oatmeal and Shea Butter Body Wash",61
"body lotions soap","Rose Geranium Soap",61
"body lotions soap","Cocoa Butter Formula Skin Therapy Oil",61
"body lotions soap","Beach Defense Water + Sun Barrier Spray Sunscreen Spf 70",61
"body lotions soap","Ultimate Eczema Relief Lotion",60
"body lotions soap","Hibiscus & Cardamom Natural Hand Wash",59
"body lotions soap","Silk Whimsy Cleaning Body Wash",59
"body lotions soap","MicroMist Airbrush Sunless Tan, Deep-3 Shades Darker",59
"body lotions soap","Extra Creamy + Coconut Miracle Oil Body Wash",58
"body lotions soap","Moisturizing Body Lotion",58
"body lotions soap","Cocoa & Cupuaçu Butters Body Lotion",57
"body lotions soap","The Soothing Remover Cleansing Towelettes for Sensitive Skin",57
"body lotions soap","Men's 3-In-1 Lotion",57
"body lotions soap","Body Lotion Intense Skin Repair",56
"body lotions soap","Spongebob Bubble Bath",55
"body lotions soap","Moisturizing Cream For Dry Sensitive Skin",55
"body lotions soap","Body Lotion Shea Butter and Vitamin E",55
"body lotions soap","Foaming Body Wash - Cucumber Mint",54
"body lotions soap","Smoothing In Shower Lotion",52
"body lotions soap","Unscented Bubble Bath",51
"body lotions soap","Men Hair & Body Wash",51
"body lotions soap","For Men Active 3 in 1 Body Wash",50
"body lotions soap","Visible Care Creme Body Wash",50
"body lotions soap","Beeswax & Banana Hand Creme",50
"body lotions soap","Gentle Exfoliating Body Wash Twin Pack",49
"body lotions soap","Sheer Touch Lotion Sunscreen SPF 30",48
"body lotions soap","Bubble Bath, Honey",48
"body lotions soap","Chill Out In A Bubble Bath",48
"body lotions soap","Clearly Sheer Beach/Pool Lotion Spray SPF 50+",46
"body lotions soap","Kids Ninja Turtles Liquid Hand Soap",45
"body lotions soap","DailyAdvance Ultra Hydrating Lotion",45
"body lotions soap","Clinical Endurance Cool Wave Clear Gel Tough Protection Anti-Perspirant/Deodorant",45
"body lotions soap","Moisture Outlast Age Defying Beauty Bar 3.75 oz 6 count Personal Cleansing",44
"body lotions soap","Foot Cream, Healing, Aloe",44
"body lotions soap","Kids Broad Spectrum 50+ Spray Sunscreen",44
"body lotions soap","Gold Temptation Refreshing Shower Gel",44
"body lotions soap","Sunscreen Face SPF 60+ Sensitive Skin Sunblock",42
"body lotions soap","Sport Performance Coolzone",42
"body lotions soap","Hydrating Moisturizing Lotion for Men",42
"body lotions soap","Sport Sunscreen Lotion SPF 50",41
"body lotions soap","Body Oil Fragrance-Free",40
"body lotions soap","Sandalwood Soap",40
"body lotions soap","Men+Care Body and Face Wash",40
"body lotions soap","Light Sesame Formula Body Lotion",39
"body lotions soap","Island Sport SPF 30 Sunscreen",39
"body lotions soap","Natural Glow Daily Moisturizer Medium/Tan",39
"body lotions soap","Body Wash, Nourishing, Classic Carrot Scent, For Normal to Dry Skin",38
"body lotions soap","Unscented Body Soap",38
"body lotions soap","Intensive Care Spray Moisturizer, Non-Greasy",38
"body lotions soap","Moisturizing Cream Skin Cream",37
"body lotions soap","Aloe Bar Soap",36
"body lotions soap","Fine Fragrance Love Forever™ Body Wash",34
"body lotions soap","Bearglove Body Wash",34
"body lotions soap","Wet Skin Broad Spectrum SPF 30 Sunscreen Spray",34
"body lotions soap","Mandarin Mango Hand Soap",34
"body lotions soap","Nourish Strengthener",34
"body lotions soap","Tea Tree Oil",33
"body lotions soap","Fast Hand Absorb",32
"body lotions soap","Unscented Sensitive Body Wash",31
"body lotions soap","Ultra Healing Intensive Lotion for Extra-Dry, Tight Skin",31
"body lotions soap","Skin Therapy Lotion Healing Fragrance Free for Sensitive Skin",31
"body lotions soap","Daily Moisturizing Lotion Sheer Hydration",31
"body lotions soap","Antibacterial Moisturizing Hand Soap Refill",30
"body lotions soap","Foaming Hand Wash, Rosemary - Mint",30
"body lotions soap","Lavender Vanilla Body Lotion",29
"body lotions soap","Unscented Moisturizing Lotion",29
"body lotions soap","Serenity Moisturizing Body Wash",29
"body lotions soap","Cooling Body Lotion",27
"body lotions soap","Extra-Dry Skin Advanced Therapy Moisturizing Lotion",27
"body lotions soap","Omega 3 Skin Food Ultra Moisturizing Unscented Body Lotion",25
"body lotions soap","Grapefruit Rejuvenating Body Wash",23
"body lotions soap","Sport Sunscreen Stick SPF 55",22
"body lotions soap","Hand Cream, Shea Butter, Lavender",22
"body lotions soap","Ultimate CoQ10 Restoring Skin Therapy Lotion",22
"body lotions soap","Himalayan Crystal Lavender Bath Salt",21
"body lotions soap","Hydrating Cleanser Bar",20
"body lotions soap","Regenerist Micro-Sculpting Cream Fragrance Free",19
"body lotions soap","Honey Almond Soap Bar",17
"body lotions soap","Arnica Sports Shower Gel",17
"body lotions soap","Hydrating Coconut Lotion",16
"body lotions soap","Coconut Oil Body Oil 5.1 Oz",11
"body lotions soap","Original Hand Sanitizer",9
"body lotions soap","Rose Aura Glow Body & Massage Oil",7
"body lotions soap","Anjou Pear Hand Soap",6
