Aisles,Product,amountBought
"body lotions soap","Deep Moisture Body Wash",13723
"body lotions soap","White Beauty Bar",13287
"body lotions soap","Classic Lavender & Chamomile Liquid Hand Soap",12403
"body lotions soap","Sensitive Skin Moisturizing Cream Soap Bars",11320
"body lotions soap","Crisp Cucumber & Melon Liquid Hand Soap",9627
"body lotions soap","Sweet Water Hand Wash",9127
"body lotions soap","Soothing Aloe Vera Moisturizing Body Wash",8682
"body lotions soap","Aquarium Series Liquid Hand Soap Refill",6357
"body lotions soap","Daily Moisturizing Lotion",6309
"body lotions soap","Spring Water Antibacterial Liquid Hand Soap with Moisturizer",6167
"body lotions soap","Foaming Hand Wash Sweet Water",5866
"body lotions soap","Sea Minerals Foaming Hand Wash",5378
"body lotions soap","Sensitive Skin Moisturizing Body Wash",5018
"body lotions soap","gel hand wash sea minerals",4905
"body lotions soap","Refreshing Gel Hand Sanitizer Pump",4668
"body lotions soap","Purely Pampering Body Wash Shea Butter and Warm Vanilla",4103
"body lotions soap","Cucumber and Green Tea Body Wash",4072
"body lotions soap","Sensitive Skin Unscented Hypo-Allergenic Beauty Bar",3955
"body lotions soap","Aquarium Pump Hand Soap",3924
"body lotions soap","Moisturizing Lotion",3723
"body lotions soap","Antibacterial Hand Wash with Moisturizers",3364
"body lotions soap","Original Bar Soap",3347
"body lotions soap","Refreshing Ocean Breeze Body Wash",3329
"body lotions soap","Extra Fresh Body and Face Wash",3293
"body lotions soap","Pure Sport Body Wash",3285
"body lotions soap","Original Deodorant Soap",3264
"body lotions soap","White Tea and Vitamin E Antibacterial Hand Soap with Moisturizer",3105
"body lotions soap","Go Fresh Cool Moisture Beauty Bar Soap",3037
"body lotions soap","Spring Water Body Wash",3037
"body lotions soap","Fresh Citrus Antibacterial Hand Soap",2876
"body lotions soap","Moisturizing Body Wash Juicy Pomegranate & Mango Infusions",2839
"body lotions soap","Pomegranate and Lemon Verbena Body Wash",2832
"body lotions soap","Pear Foam Pump",2792
"body lotions soap","Oatmeal & Shea Butter Body Wash",2762
"body lotions soap","Lemon Mint Foaming Hand Wash",2760
"body lotions soap","Go Fresh Nutrium Moisture Body Wash Blue Fig & Orange Blossom Scent",2583
"body lotions soap","Pomegranate & Mango Hand Soap",2421
"body lotions soap","Magic Tape Refillable Dispenser 3/4"" x 850"",100,21
47308,Country Kitchen Tortilla Soup Mix,69,15
47309,Original Caffeine Free Tulsi Tea,94,7
47310,Shells & White Cheddar Mac & Cheese Family Size Macaroni and Cheese Organic,4,9
47311,Tuscan Style Herb Tu",2286
"body lotions soap","Complete Foaming Antibacterial Hand Soap Variety Pack",2280
"body lotions soap","Skin Relief Body Wash Fragrance Free",2216
"body lotions soap","Advanced Hand Sanitizer Bonus Sized Pump Aloe",2119
"body lotions soap","Ultra Moisture Body Wash With Shea Butter",2092
"body lotions soap","Complete Foaming Coconut Water Antibacterial Hand Soap",2063
"body lotions soap","Daily Moisturizing Body Wash",2020
"body lotions soap","Gel Hand Wash Refill Sweet Water",1980
"body lotions soap","Original Body Wash",1976
"body lotions soap","Moisturizing Cream",1956
"body lotions soap","Active Naturals Body Wash Calming Lavender Chamomile & Ylang Ylang",1895
"body lotions soap","French Lavender Hand Wash",1867
"body lotions soap","Soothing Aloe Vera Hand Soap Refill",1794
"body lotions soap","Gold Liquid Hand Soap",1759
"body lotions soap","Gentle Exfoliating Body Wash",1691
"body lotions soap","Hand Wash, Green Tea + Aloe",1690
"body lotions soap","Men +Care Clean Comfort Body and Face Wash",1684
"body lotions soap","Gel Hand Wash Juicy Pear",1662
"body lotions soap","Coconut & Warm Ginger Liquid Hand Soap",1650
"body lotions soap","Complete Spring Water Foaming Antibacterial Hand Wash",1614
"body lotions soap","go fresh Cool Moisture Beauty",1604
"body lotions soap","Rain Bath Refreshing Shower Gel",1591
"body lotions soap","Soothing Aloe Vera Liquid Hand Soap Refill",1564
"body lotions soap","Phoenix Body Wash",1564
"body lotions soap","Healing Ointment Tube",1523
"body lotions soap","Method 10oz foaming hand wash juicy pear",1484
"body lotions soap","Deep Clean Body and Face Wash",1444
"body lotions soap","Original Deodorant Soap Bars",1433
"body lotions soap","Gold Antibacterial Deodorant Soap",1381
"body lotions soap","Age Defying Olay Age Defying Body Wash With Vitamin E",1336
"body lotions soap","Ultra Healing Lotion",1336
"body lotions soap","Body Clear Body Wash",1323
"body lotions soap","Gentle Exfoliating Beauty Bar",1316
"body lotions soap","Aloe & Green Tea Scented Hand Soap",1310
"body lotions soap","Stress Relief Lavender Body Wash",1302
"body lotions soap","Gold Bar Soap",1251
"body lotions soap","Gold Antibacterial Hand Soap",1244
"body lotions soap","Crisp Clean Antibacterial Hand Soap With Moisturizers Refill",1242
"body lotions soap","Fragrance Free Moisturizing Lotion For All Skin Types",1241
"body lotions soap","Complete Antibacterial Original Scent Foaming Hand Wash Refill",1204
"body lotions soap","Sweet Pea and Violet Body Wash",1128
"body lotions soap","Ultra Calming Makeup Removing Wipes",1121
"body lotions soap","Cool Moisture Body Wash",1112
"body lotions soap","Deep Moisture Pump Body Wash",1110
"body lotions soap","Basil & Lime Liquid Hand Soap",1093
"body lotions soap","White Beauty Bar Soap",1090
"body lotions soap","Original Refreshing Bars",1089
"body lotions soap","Essentially Enriched Body Lotion",1089
"body lotions soap","Serenity Bubble Bath",1079
"body lotions soap","Peony & Plum Liquid Hand Soap",1077
"body lotions soap","Cool 3-in-1 Body Wash",1071
"body lotions soap","Intensive Care Lotion with Cocoa Butter",1062
"body lotions soap","Extra Fresh  Body + Face Bar",1062
"body lotions soap","Complete Antibacterial Power Berries with Antioxidants Foaming Hand Wash",1037
"body lotions soap","Spring Water Antibacterial Deodorant Soap",1003
"body lotions soap","Daily Silk Body Wash",996
"body lotions soap","Epsom Salt Soaking Solution Relax & Relief",984
"body lotions soap","Lemon Scented Hand Soap",975
"body lotions soap","Tahitian Renewal  Body Wash",934
"body lotions soap","Vanilla Honey with Moisturizer Hand Soap",930
"body lotions soap","Ultimate Healing Lotion",920
"body lotions soap","Normal to Dry Skin Fragrance Free Daily Moisture Fragrance Free",908
"body lotions soap","Pink Beauty Bar",890
"body lotions soap","Body Butter Shea & Almond Oil Moisturizing Body Wash",883
"body lotions soap","Hand Wash, Foaming, Green Tea + Aloe",876
"body lotions soap","Antibacterial Original Scent Foaming Hand Wash",865
"body lotions soap","Advanced Therapy Body Lotion",864
"body lotions soap","Hand Sanitizer",846
"body lotions soap","Body Scrub Coconut Butter",840
"body lotions soap","Red Zone Swagger Body Wash",833
"body lotions soap","Original Bath Soap",826
"body lotions soap","Original Healing Rich Lotion",788
"body lotions soap","Fragrance Free Original For Dry & Sensitive Skin Lotion",787
"body lotions soap","Daily Silk Beauty Bar",777
"body lotions soap","Smooth Sensation Body Lotion",773
"body lotions soap","Advanced Therapy Lotion",764
"body lotions soap","Fig + Rhubarb Hand Wash",758
"body lotions soap","Sea Minerals Foaming Hand Wash Refill",726
"body lotions soap","Coconut Milk with Jasmine PetalsPurely Pampering Nourishing Body Wash",721
"body lotions soap","Rich Shea Butter Moisturizing Liquid Hand Soap",718
"body lotions soap","Hydrating Cleanser For Normal to Dry Skin",713
"body lotions soap","White Bar Soap",700
"body lotions soap","Happiness Moisturizing Body Wash Bamboo Essence & Orange Blossom Scent",695
"body lotions soap","Antibacterial Aloe with Moisturizer Liquid Hand Soap",695
"body lotions soap","Intensive Care Cocoa Radiant Lotion",688
"body lotions soap","Ultimate Healing Aloe Skin Therapy Lotion",678
"body lotions soap","Intensive Care Aloe Soothe Lotion",653
"body lotions soap","Aqua Impact Body and Face Wash",653
"body lotions soap","Ultra Moisture Beauty Bars",609
"body lotions soap","White Antibacterial Deodorant Soap Bars",608
"body lotions soap","Body Oil",605
"body lotions soap","Revitalizing with Vitamin E Body Lotion",597
"body lotions soap","Denali Fresh Body Wash Collection",594
"body lotions soap","Sweet Honeysuckle & Orange Peel Body Wash Moisturizing with Moisture Beads",593
"body lotions soap","Original Coconut Oil Soap",591
"body lotions soap","Sport Blast Shower Gel",579
"body lotions soap","Natural Glow + Firming Medium to Tan Skin Tones Daily Moisturizer",570
"body lotions soap","Revitalize Body Wash",555
"body lotions soap","Creamy Tropical Coconut Body Wash",553
"body lotions soap","Apollo Revitalizing Shower Gel",550
"body lotions soap","Extra Fresh Body Wash with Pump",544
"body lotions soap","Kitchen Citrus Liquid Hand Soap",538
"body lotions soap","Foaming Hand Wash Pink Grapefruit",536
"body lotions soap","Collagen Elastin Body Lotion",525
"body lotions soap","Original Moisture Body Lotion",525
"body lotions soap","Swagger Body Wash",510
"body lotions soap","Go Fresh Nutrium Moisture Cucumber & Green Tea Body Wash",510
"body lotions soap","Skin Calming Daily Moisturizing Creme",507
"body lotions soap","Men + Care Extra Fresh Body + Face Bar",504
"body lotions soap","Orchid Petals  & Mint Water Liquid Hand Soap",502
"body lotions soap","Aqua Body Wash",494
"body lotions soap","Normal to Dry Skin Daily Moisture",493
"body lotions soap","Men Refreshing Splash Body Wash",491
"body lotions soap","Coconut & Warm Ginger Hand Soap Refill",491
"body lotions soap","Basics Hypo Allergenic Soap Bars",489
"body lotions soap","Body Wash and Shower Gel Citrus Scrub",484
"body lotions soap","Sport Broad Spectrum SPF 30 Sunscreen Spray",480
"body lotions soap","Clean & Refresh Antibacterial Body Wash, Lavender & Twilight Jasmine",479
"body lotions soap","Hand Cream Fragrance Free Norwegian Formula",476
"body lotions soap","Original Bubble Bath",470
"body lotions soap","Ultra Moisture Moisturizing with Shea Butter Body Wash",467
"body lotions soap","Blackhead Clearing Green Tea Scrub",466
"body lotions soap","Fresh Awake Energizing Scent Body& Face Wash",456
"body lotions soap","Fresh Citrus Antibacterial Hand Soap with Moisturizers",454
"body lotions soap","Indulgent Coconut Milk Body Wash",448
"body lotions soap","Intensive Repair Lotion",445
"body lotions soap","Sensitive Daily Moisture Lotion",443
"body lotions soap","Woodland Soap Bar",438
"body lotions soap","Aloe Deodorant Soap Aloe",438
"body lotions soap","Instant Hand Sanitizer With Aloe",438
"body lotions soap","Ultimate Softening Lotion",437
"body lotions soap","Fast Absorbing Body and Face Lotion",436
"body lotions soap","Black Raspberry & Vanilla Hand Soap",430
"body lotions soap","Wet Skin Kids Sunscreen Spray Broad Spectrum SPF 70+",427
"body lotions soap","Citrus & Ginger Body Wash",422
"body lotions soap","Fresh Collection Fiji Body Wash",420
"body lotions soap","Eczema Therapy Moisturizing Cream",414
"body lotions soap","Soothe & Sleep With Lavander Foaming Bath",403
"body lotions soap","Intensive Care Unscented Moisturizing Lotion",401
"body lotions soap","Sensitive Skin Body Wash",387
"body lotions soap","Gentle Cleansing Bars",385
"body lotions soap","Deodorant Soap Aloe",385
"body lotions soap","Dark Temptation Refreshing Shower Gel",377
"body lotions soap","Daily Moisture Original For Dry Skin Lotion",375
"body lotions soap","Bath Laponge",372
"body lotions soap","Aloe Vera Gel",371
"body lotions soap","Fiji Body Wash",361
"body lotions soap","Sensitive Skin Nourishing Body Wash",356
"body lotions soap","Oatmeal & Almond Bar Soap",355
"body lotions soap","Hand Soap Grapefruit",350
"body lotions soap","Sport Sunscreen Spray SPF 50",348
"body lotions soap","Exfoliating Body Sponge",345
"body lotions soap","Sunscreen SPF 100+ Posted 5/21/2013 Ultra Sheer Body Mist Sunblock",345
"body lotions soap","Hand Wash Fresh Lemon & Tea Tree",341
"body lotions soap","Fabulously Fresh Peppermint & Rosemary Body Wash",339
"body lotions soap","In-Shower Nourishing Body Lotion",335
"body lotions soap","Body Wash, Moisturizing, Cherry Blossom & Wild Bamboo",335
"body lotions soap","Silkening Beauty Bar",334
"body lotions soap","Even & Bright Pink Lemon and Mandarin Orange Body Wash",333
"body lotions soap","Oatmeal & Shea Butter Body Lotion",333
"body lotions soap","Fresh Body Wash High Endurance",333
"body lotions soap","Coconut Moisturizing Lotion",327
"body lotions soap","Aqua with Vitamin E Refreshing Soap Bars",322
"body lotions soap","Sensitive Skin Beauty Bar",320
"body lotions soap","Rainbath® Renewing Shower and Bath Gel - Pear & Green Tea",318
"body lotions soap","Cocoa Butter Formula with Vit. E Massage Lotion for Stretch Marks",317
"body lotions soap","Deep Clean Body and Face Bar",314
"body lotions soap","Cocoa Butter Formula® Moisturizing Body Lotion",312
"body lotions soap","Medicated Powder",312
"body lotions soap","Detailer 2-Sided Shower Tool",311
"body lotions soap","Certified Organic 100% Pure Jojoba Oil",305
"body lotions soap","Aloe & Cucumber Bar Soaps",305
"body lotions soap","Extended Moisture Body Lotion",300
"body lotions soap","Intensive Care Advanced Healing Lotion",300
"body lotions soap","Daily Moisture Quench Body Wash",299
"body lotions soap","Shea Butter",299
"body lotions soap","Antibacterial, Pomegranate & Tangerine Hand Soap with Moisturizer",299
"body lotions soap","Skin Firming Hydration Body Lotion",295
"body lotions soap","Pure Naked Olive Leaf with Aloe Vera Moisturizing Body Wash",292
"body lotions soap","Aqua with Vitamin E Refreshing Soap",289
"body lotions soap","Moisture Blast Bar Soap",285
"body lotions soap","Evenly Gorgeous Burnt Brown Sugar & Karite Butter Body Wash",282
"body lotions soap","Sheer Twilight  Body Wash",281
"body lotions soap","Pistachio Cream Body Wash",276
"body lotions soap","Ocean Breeze Refreshing Bar Soap",275
"body lotions soap","Wild Cherry Blossom Body Wash",275
"body lotions soap","Exfoliating Body Wash with Sea Salts",272
"body lotions soap","Kitchen Citrus Bliss Foaming Hand Soap",270
"body lotions soap","Skin Relief Moisturizing Lotion Fragrance Free Body Moisture",270
"body lotions soap","Ultra Healing Extra Dry Skin Moisturizer",268
"body lotions soap","Active Naturals Positively Nourishing Body Wash With Hydrating Fig & Shea Butter",268
"body lotions soap","No-Touch Antibacterial Soothing Cucumber Splash Scent Hand Soap Refill",265
"body lotions soap","Palmer's® Cocoa Butter Formula® Moisturizing Lotion",264
"body lotions soap","Moisture Blast Body Wash",263
"body lotions soap","Total Moisture Aloe Fresh Hydrating Lotion",262
"body lotions soap","Foaming Hand Soap Lemon Scented",261
"body lotions soap","Soothing with Aloe Body Lotion",260
"body lotions soap","Body Clear Body Scrub",256
"body lotions soap","Ultra Moisture with Shea Butter Beauty Bar",255
"body lotions soap","Antibacterial Foaming Hand Soap",250
"body lotions soap","Cocoa Butter Formula Lotion With Vitamin E",246
"body lotions soap","Aqua Impact Mens Care Body And Face Bar",243
"body lotions soap","Fragrance Free Moisturizing Bar",241
"body lotions soap","Body Wash",240
"body lotions soap","Apricot  Body Wash",239
"body lotions soap","Skin Relief 24HR Moisturizing Lotion",234
"body lotions soap","Aquaphor Healing Ointment",234
"body lotions soap","Fresher Collection Timber Scent Men's Body Wash",233
"body lotions soap","Vitamin E Lotion",232
"body lotions soap","Aloe And Green Tea Foaming Hand Wash",230
"body lotions soap","Sport Performance SPF 30 Sunscreen Lotion",226
"body lotions soap","Smoothing with Cocoa Butter and Shea Body Lotion",224
"body lotions soap","Spray & Go Aloe Fresh Moisturizer",223
"body lotions soap","Citrus Spalsh & Berry Fusion Body Wash",222
"body lotions soap","Go Fresh Cool Moisture Body Wash, Cucumber & Green Tea Scent",222
"body lotions soap","Original Lotion",221
"body lotions soap","Ultra Sheer Dry-Touch Sunblock Broad Spectrum SPF 55",220
"body lotions soap","Exfoliating Deodorant Soap Bar",217
"body lotions soap","Daily Replenishing Lotion",216
"body lotions soap","Triple Moisture Body Wash",216
"body lotions soap","Cocoa Butter Body Lotion",213
"body lotions soap","Go Fresh Cool Moisture Beauty Bar",212
"body lotions soap","Pink Rosa Beauty Soap Bars",209
"body lotions soap","Sport Performance Lotion Sunscreen Spf 50",208
"body lotions soap","Ultra Fresh Hydrating Coconut Water Body Wash",207
"body lotions soap","Odor Neutralizing Kitchen Fresh Hands Hand Soap Refill",207
"body lotions soap","Whipped Cocoa Butter Soap",204
"body lotions soap","Smoothing Repair Body Lotion",203
"body lotions soap","Revive Beauty Bar",202
"body lotions soap","Soothing Bath Treatment",202
"body lotions soap","Sport Recharge Body Wash",199
"body lotions soap","Surfside  Body Wash",196
"body lotions soap","Citrus Pure Castille Soap",196
"body lotions soap","Antibacterial Hand Soap With Moisturizers White Tea & Berry Fusion",194
"body lotions soap","Deep Moisturizing Body Wash",194
"body lotions soap","Coconut and Orchid Body Lotion",193
"body lotions soap","Crème Moisture Moisturizing Body Wash",193
"body lotions soap","Frozen Frosted Berry Scented Bubble Bath",191
"body lotions soap","Advanced Hand Sanitizer Refreshing Aloe",189
"body lotions soap","Creamy Milk & Honey Splash Body Wash",187
"body lotions soap","Shea Butter Body Wash",187
"body lotions soap","Very Emollient Body Lotion Coconut Rescue",186
"body lotions soap","Hand Wash, Pink Grapefruit",185
"body lotions soap","Body Wash Pink Grapefruit Body Clear®",184
"body lotions soap","Sparkle Moisturizing Body Wash, Diamond Powder & White Calla Blossom Scent",180
"body lotions soap","Dry Touch Sunscreen SPF 70 Posted 5/21/2013 Ultra Sheer Sunblock",179
"body lotions soap","Excite Body Wash",178
"body lotions soap","Wild Collection Wolfthorn Scent Men's Body Wash",176
"body lotions soap","All-Natural Foaming Hand Sanitizer Original",176
"body lotions soap","Relax & Relief Foaming Bath",176
"body lotions soap","Indulgent Coconut Body Wash",175
"body lotions soap","Clean Comfort Body and Face Wash Pump",173
"body lotions soap","Kids Peachy Clean Body+Hair Wash",173
"body lotions soap","Black Currant & Rosewater Natural Hand Wash",172
"body lotions soap","Omega Moisture Foaming Antibacterial Hand Wash",168
"body lotions soap","Advanced Therapy Healing Ointment",167
"body lotions soap","Aqua Refreshing Bars Soap",167
"body lotions soap","Bubble Bath, for Kids, Relaxing",164
"body lotions soap","Liquid Soap Ultimate Clean Hair + Body Wash",163
"body lotions soap","For Men Odor Armor Body Wash",163
"body lotions soap","Nourishing Cocoa Butter Creme",163
"body lotions soap","Cocoa Radiant Spray Moisturizer",163
"body lotions soap","Phoenix Body Wash with Pump",160
"body lotions soap","Antibacterial Gentle Cleansing Bar",157
"body lotions soap","Calming Shampoo, Bubble Bath & Wash",155
"body lotions soap","Black Chill™ Revitalizing Shower",155
"body lotions soap","Intense Relief Hand Cream Tube Body Moisture",154
"body lotions soap","Fresh Triple Action Relief Powder Spray",152
"body lotions soap","Ultra Apple Blossom Anti-Bacterial Dish Soap",150
"body lotions soap","Body Wash Aloe",150
"body lotions soap","Body Bar Soap Soothing Vetiver",150
"body lotions soap","Coconut Milk Moisturizing Body Wash",147
"body lotions soap","Clear Hand Soap",144
"body lotions soap","Jasmine & White Cotton Foaming Hand Soap",143
"body lotions soap","Energizing Lemon Mineral Bath",142
"body lotions soap","Daily Protection SPF 30 Face Lotion",142
"body lotions soap","Sensitive Daily Moisturizing Cream",140
"body lotions soap","Petroleum Jelly",140
"body lotions soap","Mama Bee Belly Butter",140
"body lotions soap","Creme Smooth Body Wash",138
"body lotions soap","Shea Butter with Warm Vanilla Beauty Bar",138
"body lotions soap","Kids Sunscreen Lotion SPF 50",138
"body lotions soap","Lavender & Twilight Jasmine Body Wash",138
"body lotions soap","Vanilla Body Wash",137
"body lotions soap","Sport Performance Coolzone SPF 30",133
"body lotions soap","Cool Moisture Body Wash Twin Pack",132
"body lotions soap","24 hr Fresh Deep Action Scrub Body Wash",132
"body lotions soap","Tea Tree Cleansing Essential Oil",131
"body lotions soap","Liquid Hand Soap, Original",131
"body lotions soap","Eucalyptus Epsom Salt",130
"body lotions soap","Ultra Sheer Sunblock SPF 30",128
"body lotions soap","Men+Care Clean Comfort Body and Face Bar",127
"body lotions soap","Hello Hydration Herbal Essences Hello Hydration Body Wash",126
"body lotions soap","Full Force Ultimate Clean Body Wash",126
"body lotions soap","Antibacterial Soap Beige",125
"body lotions soap","Fresh & Glow Hydrating Shower Cream Milk Protein, Almond & Coconut Body Wash",123
"body lotions soap","Ocean Breeze Body Wash",121
"body lotions soap","Dry Touch Sunscreen SPF 100+",121
"body lotions soap","Beach Defense Sunscreen Lotion Broad Spectrum SPF 30",120
"body lotions soap","Unscented Glycerine Soap",116
"body lotions soap","Almond Cream and Hibiscus Body Wash",114
"body lotions soap","Body and Bath Oil - Lemon & Vitamin E",114
"body lotions soap","Sport Performance Clear UltraMist SPF 30 with Powerstay Technology Sunscreen Spray",112
"body lotions soap","Mesh Bath Sponge",110
"body lotions soap","Shea Butter Lotion",110
"body lotions soap","Original Healing Soothing Repair Creme Jar",108
"body lotions soap","Ultra Moisture Coconut Oasis Body Wash",107
"body lotions soap","Liquid Hand Soap With Aloe Vera",107
"body lotions soap","Creme Moisturizer",107
"body lotions soap","Adore Forever Body Wash",106
"body lotions soap","Soft Moisturizing Crème",106
"body lotions soap","Hawkridge Body Wash",104
"body lotions soap","Wildly Natural Cream Lavender Scent",104
"body lotions soap","Dove Bar Soap Sensitive Skin",102
"body lotions soap","Eczema Relief Body Creme",102
"body lotions soap","Detoxify & Energize with Ginger & Clay Pure Epsom Salt Soaking Solution",100
"body lotions soap","Body Wash, Restoring, Marula Oil Infused",96
"body lotions soap","Men Extra Strength Lotion",95
"body lotions soap","Intensive Care Essential Healing Lotion",93
"body lotions soap","Passionate Spell Body Wash",93
"body lotions soap","Very Clean Hand Soap Cucumber",91
"body lotions soap","Medicated Creme",91
"body lotions soap","Liquid Lotion Sunscreen SPF 55",91
"body lotions soap","Ultra Sheer Body Mist Sunscreen Broad Spectrum SPF 45",91
"body lotions soap","Indian Hemp & Haitian Vetiver Body Wash",90
"body lotions soap","Hand Salve",90
"body lotions soap","Lavender Shea Hand Soap",89
"body lotions soap",Sunscreen,86
"body lotions soap","Hydro Boost Gel-Cream for Extra-Dry Skin",86
"body lotions soap","Daily Moisture Lotion with SPF 15",86
"body lotions soap","Moisturizing Aloe Aftersun Lotion",86
"body lotions soap","For Men 3 In 1 Nourishing Lotion Sea Minerals",85
"body lotions soap","Deep Tanning Oil Spray Sunscreen SPF 4",84
"body lotions soap","Revitalizing Pear & Soy Body Wash",84
"body lotions soap","Ultimate Healing Lotion, Aloe",83
"body lotions soap","Refreshing Deodorant Soap Classic Scent",83
"body lotions soap","Cucumber Hand Soap",83
"body lotions soap","Citrus Orange Organic Pure Castile Magic Soap",82
"body lotions soap","Orange Lavender Lotion",82
"body lotions soap","Pure-Castile Soap, 18-in-1 Hemp, Eucalyptus",81
"body lotions soap","Greek Yogurt Vanilla Honey",81
"body lotions soap","Wild Collection Wolfthorn Body Spray",81
"body lotions soap","Eczema Therapy Cream",79
"body lotions soap","Ultimate Diabetic Dry Skin Relief Lotion",79
"body lotions soap","Positively Ageless Firming Body Lotion",78
"body lotions soap","Aromatherapaes Uplifting Energy Tangerine & Peppermint Spa Bath",78
"body lotions soap","Petroleum Jelly Cream Deep Moisture Vitamin E",78
"body lotions soap","Essentials Creamy Mango & Hibiscus Body Wash",78
"body lotions soap","Cherry Blossom Liquid Hand Soap",77
"body lotions soap","Fresh Outlast Soothing Orchid & Black Currant Body Wash 23.6oz  Personal Cleansing",77
"body lotions soap","Sublime Bronze ProPerfect Salon Airbrush Self-Tanning Mist - Medium",77
"body lotions soap","Hydro Boost Water Gel Facial Moisturizer",76
"body lotions soap","Essentials Clearly Natural Glycerine Soap Vitamin E",76
"body lotions soap","Maximum Hydration 3-in-1 Body Wash",75
"body lotions soap","Active Naturals Positively Nourishing Smoothing Body Wash Pomegranate & Rice",75
"body lotions soap","Classic Old Spice Classic Body Wash 18 fl oz  Male Personal Cleansing",73
"body lotions soap","Macadamia Oil & Peony Body Wash",73
"body lotions soap","Sport Performance Coolzone SPF 30 Sunscreen",72
"body lotions soap","Daily Protection Body Lotion SPF 15",71
"body lotions soap","Organic Lotion Lavender Coconut",70
"body lotions soap","Energy 3-in-1 Body Wash",70
"body lotions soap","Tuscan Blood Orange Body Butter",70
"body lotions soap","Smoothing Cocoa Butter and Shea Body Lotion",69
"body lotions soap","Mountain Fresh Body Wash",69
"body lotions soap","Working Hands Hand Cream",69
"body lotions soap","Cream Oil Intensive Body Lotion",69
"body lotions soap","Cocoa Radiant Body Gel Oil",69
"body lotions soap","Advanced Repair Fragrance Free Lotion",69
"body lotions soap","Organic  Patchouli Lime Hand & Body Lotion",67
"body lotions soap","Original Healing Soothing Repair Lotion",67
"body lotions soap","Shower Gel, Anti-Stress, Woodland Pine & Ginseng",67
"body lotions soap","Endless Kiss Body Wash",67
"body lotions soap","Dry Skin Cream Rich Hydrating Facial Moisturizer",66
"body lotions soap","Restoraderm Skin Restoring Body Wash",66
"body lotions soap","Bath Effervescents For Sore Muscles",66
"body lotions soap","Naturals Apothecary Shea Butter Hand Cream Aloe & Green Tea",64
"body lotions soap","Liquid Hand Soap With Aloe",64
"body lotions soap","White Label Forest Body Wash",64
"body lotions soap","Daily Moisture Quench Beauty Bar Soap",64
