Aisles,Product,amountBought
"canned jarred vegetables","Organic Diced Tomatoes",222324
"canned jarred vegetables","Organic Tomato Paste",182954
"canned jarred vegetables","Diced Tomatoes",147104
"canned jarred vegetables","Organic Whole Kernel Sweet Corn No Salt Added",140586
"canned jarred vegetables","Organic Tomato Sauce",140418
"canned jarred vegetables","Tomato Sauce",135031
"canned jarred vegetables","Crushed Tomatoes",118888
"canned jarred vegetables","Organic No Salt Added Diced Tomatoes",110397
"canned jarred vegetables","Organic Crushed Fire Roasted Tomatoes",73396
"canned jarred vegetables","Mild Diced Green Chiles",71057
"canned jarred vegetables","Fresh Cut Golden Sweet Whole Kernel Corn",64393
"canned jarred vegetables","Tomatoes, Whole Peeled",59292
"canned jarred vegetables","Organic Whole Peeled Tomatoes",57127
"canned jarred vegetables","Crushed Tomatoes with Basil",55523
"canned jarred vegetables","Minced Garlic",48196
"canned jarred vegetables","Chopped Tomatoes",43621
"canned jarred vegetables","Organic Premium Tomato Paste",43152
"canned jarred vegetables","Organic Chopped Garlic",43025
"canned jarred vegetables","Organic Tomato Paste, No Salt Added",41390
"canned jarred vegetables","Whole Hearts of Palm",35515
"canned jarred vegetables","Natural Tomato Paste",32820
"canned jarred vegetables","100% Natural Tomato Sauce",31422
"canned jarred vegetables","Vegetarian Organic Golden Corn",31262
"canned jarred vegetables","Organic Crushed Tomatoes with Basil",28261
"canned jarred vegetables","Organic Unsalted Diced Tomatoes",27802
"canned jarred vegetables","Whole Peeled Tomatoes",25789
"canned jarred vegetables","100% Natural Diced Tomatoes",25149
"canned jarred vegetables","Sliced Beets No Salt Added",24615
"canned jarred vegetables","Minced Ginger",24008
"canned jarred vegetables","Original Diced Tomatoes & Green Chilies",23975
"canned jarred vegetables","Organic Diced Fire Roasted Tomatoes",23837
"canned jarred vegetables","Strained Tomatoes",23173
"canned jarred vegetables","All Purpose Crushed Tomatoes",22462
"canned jarred vegetables","Tomatoes Sauce",22239
"canned jarred vegetables","Organic Strained Tomatoes",21564
"canned jarred vegetables","Organic Diced Tomatoes Fire Roasted with Medium Green Chilies",20077
"canned jarred vegetables","Double Concentrated Tomato Paste in Tube",18736
"canned jarred vegetables","Organic Diced Fire Roasted No Salt Added Tomatoes",18340
"canned jarred vegetables","Fresh Cut Green Beans",16942
"canned jarred vegetables","Organic Baby Corn Pieces",16819
"canned jarred vegetables","Organic Tomato Puree",16449
"canned jarred vegetables","Organic Fire Roasted Diced Tomatoes",16386
"canned jarred vegetables","Organic Tomato Sauce No Salt Added",16080
"canned jarred vegetables","Whole Kernel Sweet Corn",15346
"canned jarred vegetables","Organic Diced Tomatoes with Italian Herbs",15317
"canned jarred vegetables","Organic Stewed Tomatoes",15279
"canned jarred vegetables","Tomatoes, Crushed, Organic",14821
"canned jarred vegetables","Petite Diced Tomatoes",14363
"canned jarred vegetables","Organic Whole Peeled Plum Tomatoes",13969
"canned jarred vegetables","100% Organic Diced Tomatoes",13488
"canned jarred vegetables","Tomato Purée",13339
"canned jarred vegetables","Whole Kernel Corn No Salt Added",11831
"canned jarred vegetables","Organic Hearts Of Palm",11673
"canned jarred vegetables","100% Natural Petite Diced Tomatoes",11553
"canned jarred vegetables","San Marzano Peeled Tomatoes",10937
"canned jarred vegetables","Fresh Cut Sweet Peas",10468
"canned jarred vegetables","100% Natural Diced Fire Roasted Tomatoes",10260
"canned jarred vegetables","Mild Diced Tomatoes & Green Chilies",9414
"canned jarred vegetables","Fire Roasted Crushed Tomatoes",9369
"canned jarred vegetables","100% Natural Whole Peeled Plum Tomatoes",9001
"canned jarred vegetables","Sundried Tomatoes in Olive Oil",8899
"canned jarred vegetables","Organic Mild Vinegar Beets",8358
"canned jarred vegetables","Sun-Ripened Dried Tomatoes",8077
"canned jarred vegetables","Fancy Whole Artichoke Hearts",7998
"canned jarred vegetables","Fresh Cut Cream Style Golden Sweet Corn",7780
"canned jarred vegetables","Organic Sun Dried Tomatoes",7702
"canned jarred vegetables","Organic Crushed Tomatoes No Salt Added",7654
"canned jarred vegetables","Capers, Non-Pareil",7584
"canned jarred vegetables","Quartered & Marinated Artichoke Hearts",7455
"canned jarred vegetables","French Style Fresh Cut Green Beans",7208
"canned jarred vegetables","Fire Roasted Red Peppers",7204
"canned jarred vegetables","Whole Kernel Golden Sweet Corn",7167
"canned jarred vegetables","Organic Grated Ginger",7157
"canned jarred vegetables","Organic Red Roasted Peppers",7083
"canned jarred vegetables","Organic Mild Green Chiles Diced",6407
"canned jarred vegetables","Artichoke Heart",5878
"canned jarred vegetables","Green Beans, Organic, Cut",5557
"canned jarred vegetables","Diced Basil Garlic & Oregano Tomatoes",5474
"canned jarred vegetables","Original Canned Diced Tomatoes & Green Chilies",5429
"canned jarred vegetables","Cooking Sauce, La Pizza",5319
"canned jarred vegetables","Natural Artichoke Hearts Quartered",5206
"canned jarred vegetables","Quartered Artichoke Hearts",5174
"canned jarred vegetables","Diced Green Chiles",5109
"canned jarred vegetables","Organic Gut Shot Ginger Beet Probiotic Drink",5018
"canned jarred vegetables","Hearts of Palm",4926
"canned jarred vegetables","Diced Fire Roasted W/Garlic Tomatoes",4892
"canned jarred vegetables","Whole Kernel Corn",4840
"canned jarred vegetables","Organic Chunky Tomato Sauce",4604
"canned jarred vegetables","Roasted Sweet Peppers",4510
"canned jarred vegetables","100% Natural No Salt Added Tomato Sauce",4476
"canned jarred vegetables","Organic Italian Whole Peeled Tomatoes",4413
"canned jarred vegetables","Marinated Artichoke Hearts",4385
"canned jarred vegetables","Sun Dried Tomatoes",4267
"canned jarred vegetables","Fresh Cut Blue Lake No Salt Added Cut Green Beans",4169
"canned jarred vegetables","Diced Jalapenos",4168
"canned jarred vegetables","Organic Petite Diced Tomatoes",4104
"canned jarred vegetables","Grilled Marinated Artichoke Hearts",3834
"canned jarred vegetables","100% Organic Whole Peeled Tomatoes",3804
"canned jarred vegetables","Organic Crushed Tomatoes",3615
"canned jarred vegetables","Fresh Cut Sliced Carrots",3601
"canned jarred vegetables","Organic Fire Roasted Petite Diced Tomatoes with Roasted Garlic",3347
"canned jarred vegetables","Very Young Small Small Peas",3287
"canned jarred vegetables","100% Natural Stewed Tomatoes",3199
"canned jarred vegetables","No Salt Added Fresh Cut Sweet Peas",3127
"canned jarred vegetables","Chopped Garlic In Water",3115
"canned jarred vegetables","Organic Chopped Shallots",3025
"canned jarred vegetables","Sliced Beets",2886
"canned jarred vegetables","Whole Kernel Corn Golden Sweet",2770
"canned jarred vegetables","Basil Garlic & Oregano Tomatoes Sauce",2713
"canned jarred vegetables","Mushroom Pieces & Stems",2695
"canned jarred vegetables","Hot Diced Tomatoes With Habaneros",2689
"canned jarred vegetables","Very Young Small Sweet Peas",2670
"canned jarred vegetables","100% Natural No Salt Diced Tomatoes",2662
"canned jarred vegetables","Artichoke Hearts Marinated Quartered",2517
"canned jarred vegetables","Tomatoes, Finely Chopped",2497
"canned jarred vegetables","Whole Baby Corn",2491
"canned jarred vegetables","Premium Traditional Homestyle Cream Style Corn",2466
"canned jarred vegetables","Organic Diced Tomatoes with Basil & Garlic",2439
"canned jarred vegetables","Bamboo Shoots Sliced",2437
"canned jarred vegetables","Julienne Sun Dried Tomato in Olive Oil",2429
"canned jarred vegetables","Quartered Marinated Artichoke Hearts",2396
"canned jarred vegetables","Mild Diced Green Chiles Fire Roasted",2358
"canned jarred vegetables","Sun-Dried Tomatoes In Extra Virgin Olive Oil",2315
"canned jarred vegetables","Roasted Red Peppers In Water",2282
"canned jarred vegetables","Diced Tomatoes with Mild Green Chilies",2174
"canned jarred vegetables","Mushrooms Pieces & Stems",2151
"canned jarred vegetables","Steam Crisp White Shoepeg Corn",2147
"canned jarred vegetables","California Style Marinated Artichoke Hearts",2111
"canned jarred vegetables","Fresh Cut Golden Sweet No Salt Added Whole Kernel Corn",2069
"canned jarred vegetables","Organic Sliced Jalapeños",2069
"canned jarred vegetables","Mild Whole Sweet Peppers",2033
"canned jarred vegetables","Diced Peeled Tomatoes in Tomato Juice",2031
"canned jarred vegetables","Cream Style Corn",2008
"canned jarred vegetables","D.O.P. San Marzano Tomatoes",1985
"canned jarred vegetables","Organic San Marzano Diced Tomatoes",1964
"canned jarred vegetables","Sliced Sweet Pimientos",1937
"canned jarred vegetables","Diced with Basil Garlic & Oregano Tomatoes",1925
"canned jarred vegetables","Mexican Lime & Cilantro Diced Tomatoes",1864
"canned jarred vegetables","Whole New Potatoes",1856
"canned jarred vegetables","Whole Kernel Southwest with Poblano & Red Peppers Corn",1811
"canned jarred vegetables","Fresh Cut French Style Green Beans",1792
"canned jarred vegetables","Cut Yams In Light Syrup Sweet Potatoes",1785
"canned jarred vegetables","Whole Kernel Golden Corn",1762
"canned jarred vegetables","Roma Style Tomatoes Tomato Sauce",1737
"canned jarred vegetables","Blackeye Peas",1733
"canned jarred vegetables","Peeled Italian Plum Tomatoes",1703
"canned jarred vegetables","Crushed Tomatoes  No Salt Added",1692
"canned jarred vegetables","Crushed Fire Roasted With Eggplant, Kale & Beet Puree",1677
"canned jarred vegetables","Organic Sliced Bamboo Shoots",1650
"canned jarred vegetables","Diced Tomatoes No Salt Added",1622
"canned jarred vegetables","Sliced Peeled Water Chestnuts",1608
"canned jarred vegetables","50% Less Sodium Blue Lake Cut Green Beans",1607
"canned jarred vegetables","Reese Artichoke Hearts",1584
"canned jarred vegetables","Low Salt Whole Kernel Corn",1577
"canned jarred vegetables","Italian Style Roasted Peppers",1564
"canned jarred vegetables","Organic Sliced Mushrooms",1559
"canned jarred vegetables","Salsa de Chile Fresco",1550
"canned jarred vegetables","Bianco Organic Whole Peeled Tomatos",1528
"canned jarred vegetables","Tomato Puree",1511
"canned jarred vegetables","Green Lima Beans",1500
"canned jarred vegetables","Whole Water Chestnuts",1494
"canned jarred vegetables","Organic Sliced Portobello Mushrooms",1492
"canned jarred vegetables","Original Recipe Stewed Tomatoes",1484
"canned jarred vegetables","Classic Tomato Puree",1458
"canned jarred vegetables","Artichoke Hearts, Quartered",1450
"canned jarred vegetables","Organic Whole Fire Roasted Tomatoes",1444
"canned jarred vegetables","Minced Garlic in Extra Virgin Olive Oil",1439
"canned jarred vegetables","100% Organic Chickpeas",1438
"canned jarred vegetables","Organic Whole Peeled Tomatoes with Basil",1435
"canned jarred vegetables","Organic Diced Tomatoes No Salt Added",1429
"canned jarred vegetables","Fresh Cut Whole Leaf Spinach",1406
"canned jarred vegetables","Italian Garlic Paste",1396
"canned jarred vegetables","California Grown Chopped Garlic",1384
"canned jarred vegetables","Petite-Cut Diced Tomatoes",1375
"canned jarred vegetables","Steam Crisp Mexicorn",1360
"canned jarred vegetables","No Salt Added Tomato Sauce",1353
"canned jarred vegetables","Cream Style Sweet Corn",1331
"canned jarred vegetables","Vacuum Packed Summer Crisp Whole Kernel Corn",1321
"canned jarred vegetables","Minced Roasted Garlic",1288
"canned jarred vegetables","Italian Chopped Tomatoes",1288
"canned jarred vegetables","Roasted Red Peppers with Garlic in Olive Oil, Mild",1269
"canned jarred vegetables","Tomato Paste with Roasted Garlic",1256
"canned jarred vegetables","Whole Green Beans",1239
"canned jarred vegetables","Petite Cut Diced Tomatoes",1232
"canned jarred vegetables","Steam Crisp Corn Niblets",1210
"canned jarred vegetables","Organic Diced with Garlic & Onion Tomatoes",1182
"canned jarred vegetables","Fresh Cut Sliced Beets",1170
"canned jarred vegetables","Stewed Italian Recipe Tomatoes",1170
"canned jarred vegetables","Roma Style Tomato Puree",1152
"canned jarred vegetables","Artichoke Hearts Quartered",1142
"canned jarred vegetables","Peeled Tomatoes San Marzano Organic With Basil Leaf",1106
"canned jarred vegetables","Fresh Cut Golden Sweet Cream Style  Corn",1092
"canned jarred vegetables","Stems & Pieces Mushrooms",1088
"canned jarred vegetables","Whole Baby Sweet Corn",1078
"canned jarred vegetables","Bruschetta, Artichoke",1060
"canned jarred vegetables","Petite Diced Fire Roasted Tomatoes",1044
"canned jarred vegetables","Mushroom Stems & Pieces",1037
"canned jarred vegetables","Organic Fire Roasted Red & Yellow Peppers",1036
"canned jarred vegetables","Petite Diced Tomatoes In Tomato Juice",1028
"canned jarred vegetables","Artichoke Quarters",1026
"canned jarred vegetables","Artichoke Bottoms",1016
"canned jarred vegetables","Extra Long Asparagus Spears",1009
"canned jarred vegetables","Organic Crushed Arabella Plum Tomatoes",985
"canned jarred vegetables","Salad Cut Hearts Of Palm",981
"canned jarred vegetables","Tomato Sauce with Sea Salt",978
"canned jarred vegetables","No Salt Added Whole Kernel Corn",974
"canned jarred vegetables","Tomato Sauce No Salt Added",969
"canned jarred vegetables","Seasoned Collard Greens",967
"canned jarred vegetables","Diced Tomatoes With Green Chilies In Tomato Juice",958
"canned jarred vegetables","Sliced Carrots",950
"canned jarred vegetables","Sliced Fancy French Style Green Beans",948
"canned jarred vegetables","Italian Peeled Tomatoes",947
"canned jarred vegetables","One Top Tomato Pizza Sauce",945
"canned jarred vegetables","Ready-Cut Diced Tomatoes",941
"canned jarred vegetables","Supersweet Corn",925
"canned jarred vegetables","Stewed Mexican Recipe Sliced Tomatoes",924
"canned jarred vegetables","Raw Probiotic Drink Gut Shot Smoked Jalapeno",917
"canned jarred vegetables","Organic Ground Peeled Tomatoes",915
"canned jarred vegetables","Gold & White Corn",914
"canned jarred vegetables","Organic Italian Peeled Tomatoes",903
"canned jarred vegetables","Italian Style Whole Peeled Tomatoes With Basil Leaf",898
"canned jarred vegetables","Minced Garlic in Water",868
"canned jarred vegetables","Fire Roasted Diced Tomatoes With Seasonings",840
"canned jarred vegetables","Tomato Puree No Salt Added",832
"canned jarred vegetables","Crushed Tomatoes in Rich Puree",832
"canned jarred vegetables","San Marzano Tomato",831
"canned jarred vegetables","Quarted Artichoke Hearts",823
"canned jarred vegetables","Italian Tomatoes Chopped",820
"canned jarred vegetables","Yams Cut Sweet Potatoes in Syrup",820
"canned jarred vegetables","Seasoned Tomato Sauce for Chili",817
"canned jarred vegetables","Piquante Peppers, Hot, Sweet, Whole",814
"canned jarred vegetables","Sun Dried Tomatoes in Oil",806
"canned jarred vegetables","Artichoke Hearts, Quartered & Marinated",797
"canned jarred vegetables","100% Natural Tomato Puree",784
"canned jarred vegetables","Imported Italian Peeled Tomatoes",783
"canned jarred vegetables","Artichoke Hearts Large Size",782
"canned jarred vegetables","Whole Peeled Plum Tomatoes",770
"canned jarred vegetables","Petite Diced Hot with Green Chilies Tomatoes",760
"canned jarred vegetables","Fire Roasted Whole Red Peppers",753
"canned jarred vegetables","Fresh Cut Blue Lake French Style Green Beans",746
"canned jarred vegetables","Fire Roasted Diced Tomatoes With Garlic",742
"canned jarred vegetables","Tomato Paste with Italian Herbs",741
"canned jarred vegetables","Mushroom Pieces & Stems No Salt Added",738
"canned jarred vegetables","Diced San Marzano Style Organic Plum Tomatoes",726
"canned jarred vegetables","Sweet Roasted Peppers",716
"canned jarred vegetables","Sliced Stewed Tomatoes",711
"canned jarred vegetables","Tomato Paste Double Concentrated",690
"canned jarred vegetables","Chili Ready Diced Tomatoes",685
"canned jarred vegetables","Stewed Tomatoes Italian Recipe",685
"canned jarred vegetables","Sauce with Italian Herbs",681
"canned jarred vegetables","Crushed Tomatoes in Heavy Purée",635
"canned jarred vegetables","Organic Crushed Tomatoes In Tomato Purée",618
"canned jarred vegetables","Crushed Italian Recipe with Oregano & Basil Tomatoes",615
"canned jarred vegetables","No Salt Added Tomatoes",614
"canned jarred vegetables","Pesto Paste",609
"canned jarred vegetables","Whole Kernel Sweet Corn No Salt Added",609
"canned jarred vegetables","Small Sweet Peas",585
"canned jarred vegetables","Deli-Sliced Roasted Bell Pepper Strips",582
"canned jarred vegetables","Marinated & Quartered Artichoke Hearts",582
"canned jarred vegetables","Ghee Garlic",581
"canned jarred vegetables","Specialties Fresh Cut Green Lima Beans",577
"canned jarred vegetables","Peeled Tomatoes",576
"canned jarred vegetables","Julienne Fancy French Style Beets",572
"canned jarred vegetables","Diced No Salt Added Tomatoes",567
"canned jarred vegetables","Quartered And Marinated Artichoke Hearts",547
"canned jarred vegetables","Roasted Sweet Red Peppers in Vinegar",537
"canned jarred vegetables","Pieces & Srems Mushrooms",522
"canned jarred vegetables","Tomato Paste Tube",521
"canned jarred vegetables","Basil Garlic & Oregano Tomato Paste",508
"canned jarred vegetables","Whole Button Mushrooms",502
"canned jarred vegetables","Crushed Tomato",491
"canned jarred vegetables","No Salt Added Sweet Peas",491
"canned jarred vegetables","Bavarian Style Sauerkraut",489
"canned jarred vegetables","Original Mixed Vegetables",489
"canned jarred vegetables","Black Eye Peas",488
"canned jarred vegetables","Steam Crisp Super Sweet Yellow & White Whole Kernel Corn",487
"canned jarred vegetables","Sun Dried Tomato Paste",486
"canned jarred vegetables","100% Natural Diced Tomatoes No Salt Added",485
"canned jarred vegetables","Fresh Cut Diced New Potatoes",479
"canned jarred vegetables","Bamboo Shoots Sliced Natural",471
"canned jarred vegetables","Sun-Dried Tomatoes Julienne Cut",467
"canned jarred vegetables","Hearts of Palm, Whole",455
"canned jarred vegetables","Fresh Cut Sliced New Potatoes",450
"canned jarred vegetables","Niblets Whole Kernel Sweet Corn",440
"canned jarred vegetables","Oh Snap! Gone Dilly Whole Kosher Dill Pickle 3.4oz",425
"canned jarred vegetables","Sun-Dried Tomatoes Halves With Herbs",423
"canned jarred vegetables","Sun Dried Tomatoes Julienne Cut With Herbs",421
"canned jarred vegetables","Pieces And Stems Mushrooms",413
"canned jarred vegetables","Premium Cut Green Beans",408
"canned jarred vegetables","Extra Small Size Artichoke Hearts",407
"canned jarred vegetables","Petite Cut Diced Tomatoes with Zesty Jalapenos",398
"canned jarred vegetables","Tomato Purée No Salt Added",394
"canned jarred vegetables","Low Sodium Sweet Peas",389
"canned jarred vegetables","Roasted Peppers",387
"canned jarred vegetables","Roma Style Tomato Paste",384
"canned jarred vegetables","California Grown Crushed Garlic",382
"canned jarred vegetables","Whole Tomatoes",369
"canned jarred vegetables","Premium Quality Young And Tender Whole Green Beans",363
"canned jarred vegetables","Whole Kernel Fire-Roasted Corn Blend",358
"canned jarred vegetables","Pickled Jalapeno Nacho Slices",356
"canned jarred vegetables","Diced Tomatoes with Oregano, Garlic & Basil",341
"canned jarred vegetables","Italiano Tomato Sauce",340
"canned jarred vegetables","French Fried Onions",334
"canned jarred vegetables","No Salt Added Cut Green Beans",334
"canned jarred vegetables","Sliced Carrots No Salt Added",333
"canned jarred vegetables","Whole Artichoke Hearts",329
"canned jarred vegetables","Organic Diced Tomatoes In Tomato Juice",326
"canned jarred vegetables","Ready-Cut Diced No Salt Added Tomatoes",325
"canned jarred vegetables","Chili Style Diced Tomatoes",322
"canned jarred vegetables","Diced Tomato",317
"canned jarred vegetables","Mushrooms Premium Large White",312
"canned jarred vegetables","Stewed Original Recipe Sliced Tomatoes",311
"canned jarred vegetables","Giorgio Sliced Mushrooms",310
"canned jarred vegetables","All In One Crushed Tomatoes",310
"canned jarred vegetables","Selected Italian Plum Tomatoes",307
"canned jarred vegetables","Cream Style Corn Golden Sweet",306
"canned jarred vegetables","Artichoke Hearts In Water",304
"canned jarred vegetables","Fire Roasted San Marzano Style Whole Tomatoes",300
"canned jarred vegetables","Imported Italian Peeled Tomatoes, Organic",299
"canned jarred vegetables","No Salt Added Fresh Cut Green Beans",299
"canned jarred vegetables","Corn Whole Kernel",298
"canned jarred vegetables","Sweet, Peeled Red Pimientos",291
"canned jarred vegetables","Imported Golden Pepperoncini",291
"canned jarred vegetables","Fire Roasted Red Peppers With Garlic",282
"canned jarred vegetables","Organic Chunky Style Crushed Tomatoes",278
"canned jarred vegetables","Pre-Cut Hearts of Palm",277
"canned jarred vegetables","Whole Mild Green Chiles",272
"canned jarred vegetables","Tomato Sauce Roasted Garlic Flavor",270
"canned jarred vegetables","Original Diced Tomatoes and Green Chilies",268
"canned jarred vegetables","Whole Kernel Golden Sweet Corn No Salt",260
"canned jarred vegetables","Pickled Jalapenos",258
"canned jarred vegetables","Tomato Concentrate",257
"canned jarred vegetables","Sun Dried Tomato Julienne Cut",252
"canned jarred vegetables","Shoestring Beets",245
"canned jarred vegetables","Cream Style Golden Sweet Corn No Salt Added",236
"canned jarred vegetables",Yams,234
"canned jarred vegetables","Sweet & Sour Red Cabbage",233
"canned jarred vegetables","Fancy Pimientos",227
"canned jarred vegetables","Sliced New Potatoes",225
"canned jarred vegetables","Shitake Mushrooms",224
"canned jarred vegetables","Organic Whole Kernel Corn",221
"canned jarred vegetables","Seasoned Southern Style Mustard Greens",219
"canned jarred vegetables","Jalapeno Peppers, Hot, Marinated, Sliced",217
"canned jarred vegetables","Stewed Tomatoes",216
"canned jarred vegetables","Tomatoes, All Purpose Ground",216
"canned jarred vegetables","Niblets Whole Kernel Sweet Corn, Extra Sweet",212
"canned jarred vegetables","Italian Crushed Tomatoes",211
"canned jarred vegetables","Diced Tomatoes with Chilies, Onion & Cilantro",209
"canned jarred vegetables","Medium Diced Tomatoes with Green Chilis",206
"canned jarred vegetables","Cut Asparagus Spears",205
"canned jarred vegetables","100% Pure Organic Pumpkin",204
"canned jarred vegetables","Marinated Quartered Artichoke Hearts",204
"canned jarred vegetables","Marinated Roasted Peppers",204
"canned jarred vegetables","Bean Salad",201
"canned jarred vegetables","Double Concentrated Tomato Paste",200
"canned jarred vegetables","Diced Tomatoes Spicy Red Pepper",197
"canned jarred vegetables","D.O.P San Marzano Tomatoes",192
"canned jarred vegetables","Morel Mushrooms",192
"canned jarred vegetables","Whole Holland-Style onions",191
"canned jarred vegetables","Petit Pois Peas",189
"canned jarred vegetables","Sweet Whole Kernel No Salt & No Sugar Added Corn",183
"canned jarred vegetables","Whole Green Chilies",182
"canned jarred vegetables","Whole Peeled Itaian Plum Tomatoes",182
"canned jarred vegetables","Yams Cut Sweet Potatoes In Orange Pineapple Sauce",181
"canned jarred vegetables","Grilled Marinated Hearts",181
"canned jarred vegetables","Sliced White Potatoes",179
"canned jarred vegetables","Sweat Peas No Salt Added",178
"canned jarred vegetables","Kitchen Sliced Green Beans",176
"canned jarred vegetables","Whole Pickled Beets",174
"canned jarred vegetables","Diced Tomatoes With Garlic & Onion",168
"canned jarred vegetables","Hot Nacho Sliced Jalapenos",167
"canned jarred vegetables","Mild Pepper Rings",165
"canned jarred vegetables","Baby Corn, Pickled Whole",165
"canned jarred vegetables",Mexicorn,164
"canned jarred vegetables","San Marzano Tomatoes With Basil",162
"canned jarred vegetables","Asparagus Spears, All White, Peeled",161
"canned jarred vegetables","Marinated Mushrooms",160
"canned jarred vegetables","Artichoke Hearts, Quartered Marinated",157
"canned jarred vegetables","Chili Beans Black Beans Mild Chili Sauce",154
"canned jarred vegetables","Italian Crushed Tomatoes With Basil",153
"canned jarred vegetables","Seasoned Blackeye Peas",152
"canned jarred vegetables","Mild Diced Tomatoes with Green Chilis",151
"canned jarred vegetables","Italian Peeled Tomatoes With Basil",151
"canned jarred vegetables","No Salt Diced Tomatoes",150
"canned jarred vegetables","Asparagus, Green, Pickled",150
"canned jarred vegetables","Tomato Paste with Basil, Oregano & Garlic Flavor",150
"canned jarred vegetables","Sun Dried Tomatos With Basil",150
"canned jarred vegetables","Sliced Stewed Tomatoes With Onion Celery & Bell Pepper",148
"canned jarred vegetables","White Asparagus Peeled Spears",147
"canned jarred vegetables","Fresh Cut Chopped Spinach",146
"canned jarred vegetables","Fresh Cut Specialties Cut Golden Wax Beans",146
"canned jarred vegetables","Premium Hearts of Palm",146
"canned jarred vegetables","Hand Stuffed Garlic Olives",143
"canned jarred vegetables","Mushroom Stems & Pieces in Water",141
"canned jarred vegetables","Julienne Carrots",139
"canned jarred vegetables","Whole Beets",138
"canned jarred vegetables","Turkey Flavored Collard Greens",136
"canned jarred vegetables","Whole Kernel Fiesta Corn with Red & Green Peppers",136
"canned jarred vegetables","Whole Peeled San Marzano Tomatoes with Basil",135
"canned jarred vegetables","Pearl's Specialities Pitted Kalamata Greek Olives 6 Oz",135
"canned jarred vegetables","Whole Asparagus Spears",131
"canned jarred vegetables","Petite Diced Tomatoes No Salt Added",128
"canned jarred vegetables","Sun Dried Tomato Tapenade",127
"canned jarred vegetables","No Salt Added Diced Tomatoes With Oregano, Garlic & Basil",126
"canned jarred vegetables","French Style Green Beans with Roasted Garlic",125
"canned jarred vegetables","Glitter Candles",124
